name,id,attr1,value1,attr2,value2,attr3,value3
彩・守护・固本・清源(陆),1604,精简・防御,0,全属性,39,被疗成效,102
彩・守护・固本・忘我(陆),1607,精简・防御,0,全属性,39,仇恨,424
彩・守护・固本・健体(陆),1610,精简・防御,0,全属性,39,基础・体质PercentAdd,81
彩・守护・固本・铁壁(陆),1612,精简・防御,0,全属性,39,免伤,51
彩・击破・强击・固筋(陆),1615,精简・输出,0,全会心,278,基础・根骨,81
彩・击破・强击・聚力(陆),1618,精简・输出,0,全会心,278,基础・力道,81
彩・击破・强击・强身(陆),1621,精简・输出,0,全会心,278,基础・身法,81
彩・击破・强击・聚魂(陆),1624,精简・输出,0,全会心,278,基础・元气,81
彩・击破・固本・刚烈(陆),1627,精简・输出,0,全属性,39,全会效,555
彩・济世・灵根・妙手(陆),1630,精简・治疗,0,基础・根骨,62,治疗成效,102
彩・济世・霸体・妙手(陆),1633,精简・治疗,0,基础・体质,139,治疗成效,102
彩・济世・固本・延绵(陆),1636,精简・治疗,0,全属性,39,减蓝耗,-102
彩・济世・固本・妙手(陆),1639,精简・治疗,0,全属性,39,治疗成效,102
彩・激流・大化・月华(陆),1642,内功・攻击,75,化劲,139,内功・会效,555
彩・激流・大化・灭气(陆),1645,内功・攻击,75,化劲,139,内功・破防,555
彩・激流・月华・灭气(陆),1648,内功・攻击,75,内功・会效,278,内功・破防,555
彩・激流・灭气・月华(陆),1651,内功・攻击,75,内功・破防,278,内功・会效,555
彩・月华・大化・激流(陆),1654,内功・会效,139,化劲,139,内功・攻击,298
彩・月华・大化・灭气(陆),1657,内功・会效,139,化劲,139,内功・破防,555
彩・月华・大化・海纳(陆),1660,内功・会效,139,化劲,139,治疗,269
彩・月华・激流・灭气(陆),1663,内功・会效,139,内功・攻击,149,内功・破防,555
彩・月华・灭气・激流(陆),1666,内功・会效,139,内功・破防,278,内功・攻击,298
彩・星见・大化・激流(陆),1669,内功・会心,139,化劲,139,内功・攻击,298
彩・星见・大化・月华(陆),1672,内功・会心,139,化劲,139,内功・会效,555
彩・星见・大化・灭气(陆),1675,内功・会心,139,化劲,139,内功・破防,555
彩・星见・大化・海纳(陆),1678,内功・会心,139,化劲,139,治疗,269
彩・星见・激流・月华(陆),1681,内功・会心,139,内功・攻击,149,内功・会效,555
彩・星见・激流・灭气(陆),1684,内功・会心,139,内功・攻击,149,内功・破防,555
彩・星见・月华・激流(陆),1687,内功・会心,139,内功・会效,278,内功・攻击,298
彩・星见・月华・灭气(陆),1690,内功・会心,139,内功・会效,278,内功・破防,555
彩・星见・月华・海纳(陆),1693,内功・会心,139,内功・会效,278,治疗,269
彩・星见・灭气・激流(陆),1696,内功・会心,139,内功・破防,278,内功・攻击,298
彩・星见・灭气・月华(陆),1699,内功・会心,139,内功・破防,278,内功・会效,555
彩・星见・海纳・月华(陆),1702,内功・会心,139,治疗,134,内功・会效,555
彩・灵识・大化・激流(陆),1705,内功・命中,139,化劲,139,内功・攻击,298
彩・灵识・大化・月华(陆),1708,内功・命中,139,化劲,139,内功・会效,555
彩・灵识・大化・灭气(陆),1711,内功・命中,139,化劲,139,内功・破防,555
彩・灵识・激流・月华(陆),1714,内功・命中,139,内功・攻击,149,内功・会效,555
彩・灵识・激流・灭气(陆),1717,内功・命中,139,内功・攻击,149,内功・破防,555
彩・灵识・月华・激流(陆),1720,内功・命中,139,内功・会效,278,内功・攻击,298
彩・灵识・月华・灭气(陆),1723,内功・命中,139,内功・会效,278,内功・破防,555
彩・灵识・灭气・激流(陆),1726,内功・命中,139,内功・破防,278,内功・攻击,298
彩・灵识・灭气・月华(陆),1729,内功・命中,139,内功・破防,278,内功・会效,555
彩・灭气・大化・激流(陆),1732,内功・破防,139,化劲,139,内功・攻击,298
彩・灭气・大化・月华(陆),1735,内功・破防,139,化劲,139,内功・会效,555
彩・灭气・激流・月华(陆),1738,内功・破防,139,内功・攻击,149,内功・会效,555
彩・灭气・月华・激流(陆),1741,内功・破防,139,内功・会效,278,内功・攻击,298
彩・锐刃・大化・痛击(陆),1744,外功・攻击,62,化劲,139,外功・会效,555
彩・锐刃・大化・斩铁(陆),1747,外功・攻击,62,化劲,139,外功・破防,555
彩・锐刃・大化・狂攻(陆),1750,外功・攻击,62,化劲,139,外功・武器伤害,373
彩・锐刃・痛击・斩铁(陆),1753,外功・攻击,62,外功・会效,278,外功・破防,555
彩・锐刃・痛击・狂攻(陆),1756,外功・攻击,62,外功・会效,278,外功・武器伤害,373
彩・锐刃・斩铁・痛击(陆),1759,外功・攻击,62,外功・破防,278,外功・会效,555
彩・锐刃・斩铁・狂攻(陆),1762,外功・攻击,62,外功・破防,278,外功・武器伤害,373
彩・痛击・鹤顶・腐心(陆),1765,外功・会效,139,毒性・攻击,149,毒性・破防,555
彩・痛击・腐心・鹤顶(陆),1768,外功・会效,139,毒性・破防,278,毒性・攻击,298
彩・痛击・大化・鹤顶(陆),1771,外功・会效,139,化劲,139,毒性・攻击,298
彩・痛击・大化・腐心(陆),1774,外功・会效,139,化劲,139,毒性・破防,555
彩・痛击・大化・锐刃(陆),1777,外功・会效,139,化劲,139,外功・攻击,248
彩・痛击・大化・斩铁(陆),1780,外功・会效,139,化劲,139,外功・破防,555
彩・痛击・大化・狂攻(陆),1783,外功・会效,139,化劲,139,外功・武器伤害,373
彩・痛击・锐刃・斩铁(陆),1786,外功・会效,139,外功・攻击,124,外功・破防,555
彩・痛击・锐刃・狂攻(陆),1789,外功・会效,139,外功・攻击,124,外功・武器伤害,373
彩・痛击・见切・鹤顶(陆),1792,外功・会效,139,外功・会心,278,毒性・攻击,298
彩・痛击・见切・腐心(陆),1795,外功・会效,139,外功・会心,278,毒性・破防,555
彩・痛击・斩铁・锐刃(陆),1798,外功・会效,139,外功・破防,278,外功・攻击,248
彩・痛击・斩铁・狂攻(陆),1801,外功・会效,139,外功・破防,278,外功・武器伤害,373
彩・见切・鹤顶・腐心(陆),1804,外功・会心,139,毒性・攻击,149,毒性・破防,555
彩・见切・鹤顶・痛击(陆),1807,外功・会心,139,毒性・攻击,149,外功・会效,555
彩・见切・腐心・鹤顶(陆),1810,外功・会心,139,毒性・破防,278,毒性・攻击,298
彩・见切・腐心・痛击(陆),1813,外功・会心,139,毒性・破防,278,外功・会效,555
彩・见切・大化・鹤顶(陆),1816,外功・会心,139,化劲,139,毒性・攻击,298
彩・见切・大化・腐心(陆),1819,外功・会心,139,化劲,139,毒性・破防,555
彩・见切・大化・锐刃(陆),1822,外功・会心,139,化劲,139,外功・攻击,248
彩・见切・大化・痛击(陆),1825,外功・会心,139,化劲,139,外功・会效,555
彩・见切・大化・斩铁(陆),1828,外功・会心,139,化劲,139,外功・破防,555
彩・见切・大化・狂攻(陆),1831,外功・会心,139,化劲,139,外功・武器伤害,373
彩・见切・锐刃・痛击(陆),1834,外功・会心,139,外功・攻击,124,外功・会效,555
彩・见切・锐刃・斩铁(陆),1837,外功・会心,139,外功・攻击,124,外功・破防,555
彩・见切・锐刃・狂攻(陆),1840,外功・会心,139,外功・攻击,124,外功・武器伤害,373
彩・见切・痛击・鹤顶(陆),1843,外功・会心,139,外功・会效,278,毒性・攻击,298
彩・见切・痛击・腐心(陆),1846,外功・会心,139,外功・会效,278,毒性・破防,555
彩・见切・痛击・锐刃(陆),1849,外功・会心,139,外功・会效,278,外功・攻击,248
彩・见切・痛击・斩铁(陆),1852,外功・会心,139,外功・会效,278,外功・破防,555
彩・见切・痛击・狂攻(陆),1855,外功・会心,139,外功・会效,278,外功・武器伤害,373
彩・见切・斩铁・锐刃(陆),1858,外功・会心,139,外功・破防,278,外功・攻击,248
彩・见切・斩铁・痛击(陆),1861,外功・会心,139,外功・破防,278,外功・会效,555
彩・见切・斩铁・狂攻(陆),1864,外功・会心,139,外功・破防,278,外功・武器伤害,373
彩・心眼・鹤顶・腐心(陆),1867,外功・命中,139,毒性・攻击,149,毒性・破防,555
彩・心眼・鹤顶・痛击(陆),1870,外功・命中,139,毒性・攻击,149,外功・会效,555
彩・心眼・腐心・鹤顶(陆),1873,外功・命中,139,毒性・破防,278,毒性・攻击,298
彩・心眼・腐心・痛击(陆),1876,外功・命中,139,毒性・破防,278,外功・会效,555
彩・心眼・大化・鹤顶(陆),1879,外功・命中,139,化劲,139,毒性・攻击,298
彩・心眼・大化・腐心(陆),1882,外功・命中,139,化劲,139,毒性・破防,555
彩・心眼・大化・锐刃(陆),1885,外功・命中,139,化劲,139,外功・攻击,248
彩・心眼・大化・痛击(陆),1888,外功・命中,139,化劲,139,外功・会效,555
彩・心眼・大化・斩铁(陆),1891,外功・命中,139,化劲,139,外功・破防,555
彩・心眼・大化・狂攻(陆),1894,外功・命中,139,化劲,139,外功・武器伤害,373
彩・心眼・急速・鹤顶(陆),1897,外功・命中,139,急速,278,毒性・攻击,298
彩・心眼・急速・锐刃(陆),1900,外功・命中,139,急速,278,外功・攻击,248
彩・心眼・锐刃・痛击(陆),1903,外功・命中,139,外功・攻击,124,外功・会效,555
彩・心眼・锐刃・斩铁(陆),1906,外功・命中,139,外功・攻击,124,外功・破防,555
彩・心眼・锐刃・狂攻(陆),1909,外功・命中,139,外功・攻击,124,外功・武器伤害,373
彩・心眼・痛击・鹤顶(陆),1912,外功・命中,139,外功・会效,278,毒性・攻击,298
彩・心眼・痛击・腐心(陆),1915,外功・命中,139,外功・会效,278,毒性・破防,555
彩・心眼・痛击・锐刃(陆),1918,外功・命中,139,外功・会效,278,外功・攻击,248
彩・心眼・痛击・斩铁(陆),1921,外功・命中,139,外功・会效,278,外功・破防,555
彩・心眼・痛击・狂攻(陆),1924,外功・命中,139,外功・会效,278,外功・武器伤害,373
彩・心眼・见切・鹤顶(陆),1927,外功・命中,139,外功・会心,278,毒性・攻击,298
彩・心眼・见切・腐心(陆),1930,外功・命中,139,外功・会心,278,毒性・破防,555
彩・心眼・斩铁・锐刃(陆),1933,外功・命中,139,外功・破防,278,外功・攻击,248
彩・心眼・斩铁・痛击(陆),1936,外功・命中,139,外功・破防,278,外功・会效,555
彩・心眼・斩铁・狂攻(陆),1939,外功・命中,139,外功・破防,278,外功・武器伤害,373
彩・斩铁・大化・锐刃(陆),1942,外功・破防,139,化劲,139,外功・攻击,248
彩・斩铁・大化・痛击(陆),1945,外功・破防,139,化劲,139,外功・会效,555
彩・斩铁・大化・狂攻(陆),1948,外功・破防,139,化劲,139,外功・武器伤害,373
彩・斩铁・锐刃・痛击(陆),1951,外功・破防,139,外功・攻击,124,外功・会效,555
彩・斩铁・锐刃・狂攻(陆),1954,外功・破防,139,外功・攻击,124,外功・武器伤害,373
彩・斩铁・痛击・锐刃(陆),1957,外功・破防,139,外功・会效,278,外功・攻击,248
彩・斩铁・痛击・狂攻(陆),1960,外功・破防,139,外功・会效,278,外功・武器伤害,373
彩・无双・鹤顶・穿石(陆),1963,无双,139,毒性・攻击,149,毒性・会效,555
彩・无双・鹤顶・腐心(陆),1966,无双,139,毒性・攻击,149,毒性・破防,555
彩・无双・鹤顶・痛击(陆),1969,无双,139,毒性・攻击,149,外功・会效,555
彩・无双・穿石・鹤顶(陆),1972,无双,139,毒性・会效,278,毒性・攻击,298
彩・无双・穿石・腐心(陆),1975,无双,139,毒性・会效,278,毒性・破防,555
彩・无双・腐心・鹤顶(陆),1978,无双,139,毒性・破防,278,毒性・攻击,298
彩・无双・腐心・穿石(陆),1981,无双,139,毒性・破防,278,毒性・会效,555
彩・无双・腐心・痛击(陆),1984,无双,139,毒性・破防,278,外功・会效,555
彩・无双・雷鸣・霹雳(陆),1987,无双,139,混元・攻击,149,混元・会效,555
彩・无双・雷鸣・混沌(陆),1990,无双,139,混元・攻击,149,混元・破防,555
彩・无双・霹雳・雷鸣(陆),1993,无双,139,混元・会效,278,混元・攻击,298
彩・无双・霹雳・混沌(陆),1996,无双,139,混元・会效,278,混元・破防,555
彩・无双・混沌・雷鸣(陆),1999,无双,139,混元・破防,278,混元・攻击,298
彩・无双・混沌・霹雳(陆),2002,无双,139,混元・破防,278,混元・会效,555
彩・无双・急速・鹤顶(陆),2005,无双,139,急速,278,毒性・攻击,298
彩・无双・急速・雷鸣(陆),2008,无双,139,急速,278,混元・攻击,298
彩・无双・急速・锐刃(陆),2011,无双,139,急速,278,外功・攻击,248
彩・无双・急速・烈阳(陆),2014,无双,139,急速,278,阳性・攻击,298
彩・无双・急速・霜冷(陆),2017,无双,139,急速,278,阴性・攻击,298
彩・无双・急速・琉璃(陆),2020,无双,139,急速,278,阴阳・攻击,298
彩・无双・激流・月华(陆),2023,无双,139,内功・攻击,149,内功・会效,555
彩・无双・激流・灭气(陆),2026,无双,139,内功・攻击,149,内功・破防,555
彩・无双・月华・激流(陆),2029,无双,139,内功・会效,278,内功・攻击,298
彩・无双・月华・灭气(陆),2032,无双,139,内功・会效,278,内功・破防,555
彩・无双・灭气・激流(陆),2035,无双,139,内功・破防,278,内功・攻击,298
彩・无双・灭气・月华(陆),2038,无双,139,内功・破防,278,内功・会效,555
彩・无双・锐刃・痛击(陆),2041,无双,139,外功・攻击,124,外功・会效,555
彩・无双・锐刃・斩铁(陆),2044,无双,139,外功・攻击,124,外功・破防,555
彩・无双・锐刃・狂攻(陆),2047,无双,139,外功・攻击,124,外功・武器伤害,373
彩・无双・痛击・鹤顶(陆),2050,无双,139,外功・会效,278,毒性・攻击,298
彩・无双・痛击・腐心(陆),2053,无双,139,外功・会效,278,毒性・破防,555
彩・无双・痛击・锐刃(陆),2056,无双,139,外功・会效,278,外功・攻击,248
彩・无双・痛击・斩铁(陆),2059,无双,139,外功・会效,278,外功・破防,555
彩・无双・痛击・狂攻(陆),2062,无双,139,外功・会效,278,外功・武器伤害,373
彩・无双・见切・鹤顶(陆),2065,无双,139,外功・会心,278,毒性・攻击,298
彩・无双・见切・腐心(陆),2068,无双,139,外功・会心,278,毒性・破防,555
彩・无双・斩铁・锐刃(陆),2071,无双,139,外功・破防,278,外功・攻击,248
彩・无双・斩铁・痛击(陆),2074,无双,139,外功・破防,278,外功・会效,555
彩・无双・斩铁・狂攻(陆),2077,无双,139,外功・破防,278,外功・武器伤害,373
彩・无双・烈阳・浴火(陆),2080,无双,139,阳性・攻击,149,阳性・会效,555
彩・无双・烈阳・日炎(陆),2083,无双,139,阳性・攻击,149,阳性・破防,555
彩・无双・浴火・烈阳(陆),2086,无双,139,阳性・会效,278,阳性・攻击,298
彩・无双・浴火・日炎(陆),2089,无双,139,阳性・会效,278,阳性・破防,555
彩・无双・日炎・烈阳(陆),2092,无双,139,阳性・破防,278,阳性・攻击,298
彩・无双・日炎・浴火(陆),2095,无双,139,阳性・破防,278,阳性・会效,555
彩・无双・霜冷・杯雪(陆),2098,无双,139,阴性・攻击,149,阴性・会效,555
彩・无双・霜冷・冻髓(陆),2101,无双,139,阴性・攻击,149,阴性・破防,555
彩・无双・杯雪・霜冷(陆),2104,无双,139,阴性・会效,278,阴性・攻击,298
彩・无双・杯雪・冻髓(陆),2107,无双,139,阴性・会效,278,阴性・破防,555
彩・无双・冻髓・霜冷(陆),2110,无双,139,阴性・破防,278,阴性・攻击,298
彩・无双・冻髓・杯雪(陆),2113,无双,139,阴性・破防,278,阴性・会效,555
彩・无双・琉璃・界影(陆),2116,无双,139,阴阳・攻击,149,阴阳・会效,555
彩・无双・琉璃・焚虚(陆),2119,无双,139,阴阳・攻击,149,阴阳・破防,555
彩・无双・界影・琉璃(陆),2122,无双,139,阴阳・会效,278,阴阳・攻击,298
彩・无双・界影・焚虚(陆),2125,无双,139,阴阳・会效,278,阴阳・破防,555
彩・无双・焚虚・琉璃(陆),2128,无双,139,阴阳・破防,278,阴阳・攻击,298
彩・无双・焚虚・界影(陆),2131,无双,139,阴阳・破防,278,阴阳・会效,555
彩・烈阳・大化・浴火(陆),2134,阳性・攻击,75,化劲,139,阳性・会效,555
彩・烈阳・大化・日炎(陆),2137,阳性・攻击,75,化劲,139,阳性・破防,555
彩・烈阳・浴火・日炎(陆),2140,阳性・攻击,75,阳性・会效,278,阳性・破防,555
彩・烈阳・日炎・浴火(陆),2143,阳性・攻击,75,阳性・破防,278,阳性・会效,555
彩・浴火・大化・烈阳(陆),2146,阳性・会效,139,化劲,139,阳性・攻击,298
彩・浴火・大化・日炎(陆),2149,阳性・会效,139,化劲,139,阳性・破防,555
彩・浴火・大化・海纳(陆),2152,阳性・会效,139,化劲,139,治疗,269
彩・浴火・烈阳・日炎(陆),2155,阳性・会效,139,阳性・攻击,149,阳性・破防,555
彩・浴火・日炎・烈阳(陆),2158,阳性・会效,139,阳性・破防,278,阳性・攻击,298
彩・燎原・大化・烈阳(陆),2161,阳性・会心,139,化劲,139,阳性・攻击,298
彩・燎原・大化・浴火(陆),2164,阳性・会心,139,化劲,139,阳性・会效,555
彩・燎原・大化・日炎(陆),2167,阳性・会心,139,化劲,139,阳性・破防,555
彩・燎原・大化・海纳(陆),2170,阳性・会心,139,化劲,139,治疗,269
彩・燎原・烈阳・浴火(陆),2173,阳性・会心,139,阳性・攻击,149,阳性・会效,555
彩・燎原・烈阳・日炎(陆),2176,阳性・会心,139,阳性・攻击,149,阳性・破防,555
彩・燎原・浴火・烈阳(陆),2179,阳性・会心,139,阳性・会效,278,阳性・攻击,298
彩・燎原・浴火・日炎(陆),2182,阳性・会心,139,阳性・会效,278,阳性・破防,555
彩・燎原・浴火・海纳(陆),2185,阳性・会心,139,阳性・会效,278,治疗,269
彩・燎原・日炎・烈阳(陆),2188,阳性・会心,139,阳性・破防,278,阳性・攻击,298
彩・燎原・日炎・浴火(陆),2191,阳性・会心,139,阳性・破防,278,阳性・会效,555
彩・燎原・海纳・浴火(陆),2194,阳性・会心,139,治疗,134,阳性・会效,555
彩・灼筋・大化・烈阳(陆),2197,阳性・命中,139,化劲,139,阳性・攻击,298
彩・灼筋・大化・浴火(陆),2200,阳性・命中,139,化劲,139,阳性・会效,555
彩・灼筋・大化・日炎(陆),2203,阳性・命中,139,化劲,139,阳性・破防,555
彩・灼筋・急速・烈阳(陆),2206,阳性・命中,139,急速,278,阳性・攻击,298
彩・灼筋・烈阳・浴火(陆),2209,阳性・命中,139,阳性・攻击,149,阳性・会效,555
彩・灼筋・烈阳・日炎(陆),2212,阳性・命中,139,阳性・攻击,149,阳性・破防,555
彩・灼筋・浴火・烈阳(陆),2215,阳性・命中,139,阳性・会效,278,阳性・攻击,298
彩・灼筋・浴火・日炎(陆),2218,阳性・命中,139,阳性・会效,278,阳性・破防,555
彩・灼筋・日炎・烈阳(陆),2221,阳性・命中,139,阳性・破防,278,阳性・攻击,298
彩・灼筋・日炎・浴火(陆),2224,阳性・命中,139,阳性・破防,278,阳性・会效,555
彩・日炎・大化・烈阳(陆),2227,阳性・破防,139,化劲,139,阳性・攻击,298
彩・日炎・大化・浴火(陆),2230,阳性・破防,139,化劲,139,阳性・会效,555
彩・日炎・烈阳・浴火(陆),2233,阳性・破防,139,阳性・攻击,149,阳性・会效,555
彩・日炎・浴火・烈阳(陆),2236,阳性・破防,139,阳性・会效,278,阳性・攻击,298
彩・霜冷・大化・杯雪(陆),2239,阴性・攻击,75,化劲,139,阴性・会效,555
彩・霜冷・大化・冻髓(陆),2242,阴性・攻击,75,化劲,139,阴性・破防,555
彩・霜冷・杯雪・冻髓(陆),2245,阴性・攻击,75,阴性・会效,278,阴性・破防,555
彩・霜冷・冻髓・杯雪(陆),2248,阴性・攻击,75,阴性・破防,278,阴性・会效,555
彩・杯雪・大化・霜冷(陆),2251,阴性・会效,139,化劲,139,阴性・攻击,298
彩・杯雪・大化・冻髓(陆),2254,阴性・会效,139,化劲,139,阴性・破防,555
彩・杯雪・大化・海纳(陆),2257,阴性・会效,139,化劲,139,治疗,269
彩・杯雪・霜冷・冻髓(陆),2260,阴性・会效,139,阴性・攻击,149,阴性・破防,555
彩・杯雪・冻髓・霜冷(陆),2263,阴性・会效,139,阴性・破防,278,阴性・攻击,298
彩・化雪・大化・霜冷(陆),2266,阴性・会心,139,化劲,139,阴性・攻击,298
彩・化雪・大化・杯雪(陆),2269,阴性・会心,139,化劲,139,阴性・会效,555
彩・化雪・大化・冻髓(陆),2272,阴性・会心,139,化劲,139,阴性・破防,555
彩・化雪・大化・海纳(陆),2275,阴性・会心,139,化劲,139,治疗,269
彩・化雪・霜冷・杯雪(陆),2278,阴性・会心,139,阴性・攻击,149,阴性・会效,555
彩・化雪・霜冷・冻髓(陆),2281,阴性・会心,139,阴性・攻击,149,阴性・破防,555
彩・化雪・杯雪・霜冷(陆),2284,阴性・会心,139,阴性・会效,278,阴性・攻击,298
彩・化雪・杯雪・冻髓(陆),2287,阴性・会心,139,阴性・会效,278,阴性・破防,555
彩・化雪・杯雪・海纳(陆),2290,阴性・会心,139,阴性・会效,278,治疗,269
彩・化雪・冻髓・霜冷(陆),2293,阴性・会心,139,阴性・破防,278,阴性・攻击,298
彩・化雪・冻髓・杯雪(陆),2296,阴性・会心,139,阴性・破防,278,阴性・会效,555
彩・化雪・海纳・杯雪(陆),2299,阴性・会心,139,治疗,134,阴性・会效,555
彩・碎冰・大化・霜冷(陆),2302,阴性・命中,139,化劲,139,阴性・攻击,298
彩・碎冰・大化・杯雪(陆),2305,阴性・命中,139,化劲,139,阴性・会效,555
彩・碎冰・大化・冻髓(陆),2308,阴性・命中,139,化劲,139,阴性・破防,555
彩・碎冰・急速・霜冷(陆),2311,阴性・命中,139,急速,278,阴性・攻击,298
彩・碎冰・霜冷・杯雪(陆),2314,阴性・命中,139,阴性・攻击,149,阴性・会效,555
彩・碎冰・霜冷・冻髓(陆),2317,阴性・命中,139,阴性・攻击,149,阴性・破防,555
彩・碎冰・杯雪・霜冷(陆),2320,阴性・命中,139,阴性・会效,278,阴性・攻击,298
彩・碎冰・杯雪・冻髓(陆),2323,阴性・命中,139,阴性・会效,278,阴性・破防,555
彩・碎冰・冻髓・霜冷(陆),2326,阴性・命中,139,阴性・破防,278,阴性・攻击,298
彩・碎冰・冻髓・杯雪(陆),2329,阴性・命中,139,阴性・破防,278,阴性・会效,555
彩・冻髓・大化・霜冷(陆),2332,阴性・破防,139,化劲,139,阴性・攻击,298
彩・冻髓・大化・杯雪(陆),2335,阴性・破防,139,化劲,139,阴性・会效,555
彩・冻髓・霜冷・杯雪(陆),2338,阴性・破防,139,阴性・攻击,149,阴性・会效,555
彩・冻髓・杯雪・霜冷(陆),2341,阴性・破防,139,阴性・会效,278,阴性・攻击,298
彩・琉璃・大化・界影(陆),2344,阴阳・攻击,75,化劲,139,阴阳・会效,555
彩・琉璃・大化・焚虚(陆),2347,阴阳・攻击,75,化劲,139,阴阳・破防,555
彩・琉璃・界影・焚虚(陆),2350,阴阳・攻击,75,阴阳・会效,278,阴阳・破防,555
彩・琉璃・焚虚・界影(陆),2353,阴阳・攻击,75,阴阳・破防,278,阴阳・会效,555
彩・界影・大化・琉璃(陆),2356,阴阳・会效,139,化劲,139,阴阳・攻击,298
彩・界影・大化・焚虚(陆),2359,阴阳・会效,139,化劲,139,阴阳・破防,555
彩・界影・琉璃・焚虚(陆),2362,阴阳・会效,139,阴阳・攻击,149,阴阳・破防,555
彩・界影・焚虚・琉璃(陆),2365,阴阳・会效,139,阴阳・破防,278,阴阳・攻击,298
彩・虹卷・大化・琉璃(陆),2368,阴阳・会心,139,化劲,139,阴阳・攻击,298
彩・虹卷・大化・界影(陆),2371,阴阳・会心,139,化劲,139,阴阳・会效,555
彩・虹卷・大化・焚虚(陆),2374,阴阳・会心,139,化劲,139,阴阳・破防,555
彩・虹卷・琉璃・界影(陆),2377,阴阳・会心,139,阴阳・攻击,149,阴阳・会效,555
彩・虹卷・琉璃・焚虚(陆),2380,阴阳・会心,139,阴阳・攻击,149,阴阳・破防,555
彩・虹卷・界影・琉璃(陆),2383,阴阳・会心,139,阴阳・会效,278,阴阳・攻击,298
彩・虹卷・界影・焚虚(陆),2386,阴阳・会心,139,阴阳・会效,278,阴阳・破防,555
彩・虹卷・焚虚・琉璃(陆),2389,阴阳・会心,139,阴阳・破防,278,阴阳・攻击,298
彩・虹卷・焚虚・界影(陆),2392,阴阳・会心,139,阴阳・破防,278,阴阳・会效,555
彩・点睛・大化・琉璃(陆),2395,阴阳・命中,139,化劲,139,阴阳・攻击,298
彩・点睛・大化・界影(陆),2398,阴阳・命中,139,化劲,139,阴阳・会效,555
彩・点睛・大化・焚虚(陆),2401,阴阳・命中,139,化劲,139,阴阳・破防,555
彩・点睛・急速・琉璃(陆),2404,阴阳・命中,139,急速,278,阴阳・攻击,298
